<?xml version="1.0" encoding="UTF-8"?>
<xs:schema xmlns:xs="http://www.w3.org/2001/XMLSchema">

  <xs:complexType name="addressType">
    <xs:sequence>
      <xs:element name="street" type="xs:string"/>
      <xs:element name="city" type="xs:string"/>
    </xs:sequence>
  </xs:complexType>

  <xs:element name="person">
    <xs:complexType>
      <xs:sequence>
        <xs:element name="name" type="xs:string"/>
        <xs:element name="home" type="addressType" minOccurs="0"/>
        <xs:element name="emergency">
          <xs:complexType>
            <xs:sequence>
              <xs:element name="phone" type="xs:string"/>
              <xs:element name="relation" type="xs:string" minOccurs="0"/>
            </xs:sequence>
          </xs:complexType>
        </xs:element>
      </xs:sequence>
      <xs:attribute name="id" type="xs:ID" use="required"/>
    </xs:complexType>
  </xs:element>

</xs:schema>
